{
  "timestamp": "2026-03-01T16:38:10.556834",
  "universe": "configs/universe/m1_candidates.yaml",
  "total_symbols": 48,
  "statistics": {
    "success": 24,
    "insufficient_samples": 0,
    "missing_files": 0,
    "nan_detected": 0,
    "error": 24,
    "trainable": 24,
    "trainable_rate": 0.5
  },
  "results": [
    {
      "symbol": "SHFE.ZN",
      "status": "success",
      "error": null,
      "n_bars": 848968,
      "n_train_samples": 28121,
      "n_val_samples": 5892,
      "train_loss_first": 0.015508183278143406,
      "train_loss_last": 8.232159598264843e-05,
      "val_loss": 9.017781091339809e-05,
      "has_nan": false,
      "trainable": true
    },
    {
      "symbol": "SHFE.RU",
      "status": "error",
      "error": "Failed to load SHFE.RU: bars.parquet not found for SHFE.RU",
      "n_bars": 0,
      "n_train_samples": 0,
      "n_val_samples": 0,
      "train_loss_first": null,
      "train_loss_last": null,
      "val_loss": null,
      "has_nan": false,
      "trainable": false
    },
    {
      "symbol": "SHFE.RB",
      "status": "error",
      "error": "Failed to load SHFE.RB: bars.parquet not found for SHFE.RB",
      "n_bars": 0,
      "n_train_samples": 0,
      "n_val_samples": 0,
      "train_loss_first": null,
      "train_loss_last": null,
      "val_loss": null,
      "has_nan": false,
      "trainable": false
    },
    {
      "symbol": "SHFE.SN",
      "status": "success",
      "error": null,
      "n_bars": 835338,
      "n_train_samples": 25662,
      "n_val_samples": 5928,
      "train_loss_first": 0.13123832643032074,
      "train_loss_last": 0.00018337178335059434,
      "val_loss": 0.0001423617959517287,
      "has_nan": false,
      "trainable": true
    },
    {
      "symbol": "SHFE.AL",
      "status": "success",
      "error": null,
      "n_bars": 843184,
      "n_train_samples": 27232,
      "n_val_samples": 5836,
      "train_loss_first": 0.03147665783762932,
      "train_loss_last": 0.00023633401724509895,
      "val_loss": 0.00020099899721453372,
      "has_nan": false,
      "trainable": true
    },
    {
      "symbol": "SHFE.HC",
      "status": "error",
      "error": "Failed to load SHFE.HC: bars.parquet not found for SHFE.HC",
      "n_bars": 0,
      "n_train_samples": 0,
      "n_val_samples": 0,
      "train_loss_first": null,
      "train_loss_last": null,
      "val_loss": null,
      "has_nan": false,
      "trainable": false
    },
    {
      "symbol": "SHFE.PB",
      "status": "success",
      "error": null,
      "n_bars": 825923,
      "n_train_samples": 25830,
      "n_val_samples": 4699,
      "train_loss_first": 0.03352664038538933,
      "train_loss_last": 0.00020525488071143627,
      "val_loss": 0.0002870444379942982,
      "has_nan": false,
      "trainable": true
    },
    {
      "symbol": "SHFE.NI",
      "status": "success",
      "error": null,
      "n_bars": 848466,
      "n_train_samples": 28114,
      "n_val_samples": 5936,
      "train_loss_first": 0.042471420019865036,
      "train_loss_last": 0.00010048089461633936,
      "val_loss": 9.261413288186304e-05,
      "has_nan": false,
      "trainable": true
    },
    {
      "symbol": "SHFE.AU",
      "status": "success",
      "error": null,
      "n_bars": 978645,
      "n_train_samples": 43751,
      "n_val_samples": 9349,
      "train_loss_first": 0.04692745953798294,
      "train_loss_last": 0.00014547367754857987,
      "val_loss": 6.482877880271926e-05,
      "has_nan": false,
      "trainable": true
    },
    {
      "symbol": "SHFE.AG",
      "status": "success",
      "error": null,
      "n_bars": 981648,
      "n_train_samples": 44334,
      "n_val_samples": 9383,
      "train_loss_first": 0.0549904927611351,
      "train_loss_last": 0.00015251731383614242,
      "val_loss": 0.00011223323609384179,
      "has_nan": false,
      "trainable": true
    },
    {
      "symbol": "SHFE.CU",
      "status": "success",
      "error": null,
      "n_bars": 848485,
      "n_train_samples": 28072,
      "n_val_samples": 5927,
      "train_loss_first": 0.04151230677962303,
      "train_loss_last": 0.00013665732694789767,
      "val_loss": 0.00011805907615780598,
      "has_nan": false,
      "trainable": true
    },
    {
      "symbol": "SHFE.BU",
      "status": "error",
      "error": "Failed to load SHFE.BU: bars.parquet not found for SHFE.BU",
      "n_bars": 0,
      "n_train_samples": 0,
      "n_val_samples": 0,
      "train_loss_first": null,
      "train_loss_last": null,
      "val_loss": null,
      "has_nan": false,
      "trainable": false
    },
    {
      "symbol": "DCE.C",
      "status": "error",
      "error": "Failed to load DCE.C: bars.parquet not found for DCE.C",
      "n_bars": 0,
      "n_train_samples": 0,
      "n_val_samples": 0,
      "train_loss_first": null,
      "train_loss_last": null,
      "val_loss": null,
      "has_nan": false,
      "trainable": false
    },
    {
      "symbol": "DCE.Y",
      "status": "success",
      "error": null,
      "n_bars": 661711,
      "n_train_samples": 6233,
      "n_val_samples": 726,
      "train_loss_first": 0.01962966099381447,
      "train_loss_last": 0.0004589505842886865,
      "val_loss": 0.0005457638568865756,
      "has_nan": false,
      "trainable": true
    },
    {
      "symbol": "CZCE.SR",
      "status": "success",
      "error": null,
      "n_bars": 666257,
      "n_train_samples": 6569,
      "n_val_samples": 726,
      "train_loss_first": 0.027348054572939873,
      "train_loss_last": 0.0005270821857266128,
      "val_loss": 0.00035762417246587574,
      "has_nan": false,
      "trainable": true
    },
    {
      "symbol": "DCE.A",
      "status": "success",
      "error": null,
      "n_bars": 661532,
      "n_train_samples": 5541,
      "n_val_samples": 1010,
      "train_loss_first": 0.016073625534772873,
      "train_loss_last": 0.0007152439211495221,
      "val_loss": 0.0006408249464584514,
      "has_nan": false,
      "trainable": true
    },
    {
      "symbol": "CZCE.TA",
      "status": "success",
      "error": null,
      "n_bars": 666202,
      "n_train_samples": 6423,
      "n_val_samples": 726,
      "train_loss_first": 0.03966880217194557,
      "train_loss_last": 0.0002137366245733574,
      "val_loss": 0.00027991807049450773,
      "has_nan": false,
      "trainable": true
    },
    {
      "symbol": "DCE.M",
      "status": "success",
      "error": null,
      "n_bars": 661759,
      "n_train_samples": 5860,
      "n_val_samples": 726,
      "train_loss_first": 0.07806620001792908,
      "train_loss_last": 0.0012718852376565337,
      "val_loss": 0.0005045579164288938,
      "has_nan": false,
      "trainable": true
    },
    {
      "symbol": "DCE.B",
      "status": "error",
      "error": "Failed to load DCE.B: bars.parquet not found for DCE.B",
      "n_bars": 0,
      "n_train_samples": 0,
      "n_val_samples": 0,
      "train_loss_first": null,
      "train_loss_last": null,
      "val_loss": null,
      "has_nan": false,
      "trainable": false
    },
    {
      "symbol": "DCE.V",
      "status": "error",
      "error": "Failed to load DCE.V: bars.parquet not found for DCE.V",
      "n_bars": 0,
      "n_train_samples": 0,
      "n_val_samples": 0,
      "train_loss_first": null,
      "train_loss_last": null,
      "val_loss": null,
      "has_nan": false,
      "trainable": false
    },
    {
      "symbol": "CZCE.SM",
      "status": "error",
      "error": "Failed to load CZCE.SM: bars.parquet not found for CZCE.SM",
      "n_bars": 0,
      "n_train_samples": 0,
      "n_val_samples": 0,
      "train_loss_first": null,
      "train_loss_last": null,
      "val_loss": null,
      "has_nan": false,
      "trainable": false
    },
    {
      "symbol": "CZCE.SF",
      "status": "error",
      "error": "Failed to load CZCE.SF: bars.parquet not found for CZCE.SF",
      "n_bars": 0,
      "n_train_samples": 0,
      "n_val_samples": 0,
      "train_loss_first": null,
      "train_loss_last": null,
      "val_loss": null,
      "has_nan": false,
      "trainable": false
    },
    {
      "symbol": "DCE.J",
      "status": "success",
      "error": null,
      "n_bars": 661389,
      "n_train_samples": 5643,
      "n_val_samples": 911,
      "train_loss_first": 0.023677680641412735,
      "train_loss_last": 0.0006736539653502405,
      "val_loss": 0.00024451067292829975,
      "has_nan": false,
      "trainable": true
    },
    {
      "symbol": "DCE.PP",
      "status": "error",
      "error": "Failed to load DCE.PP: bars.parquet not found for DCE.PP",
      "n_bars": 0,
      "n_train_samples": 0,
      "n_val_samples": 0,
      "train_loss_first": null,
      "train_loss_last": null,
      "val_loss": null,
      "has_nan": false,
      "trainable": false
    },
    {
      "symbol": "DCE.JM",
      "status": "success",
      "error": null,
      "n_bars": 661417,
      "n_train_samples": 5726,
      "n_val_samples": 726,
      "train_loss_first": 0.02872570976614952,
      "train_loss_last": 0.00027956932899542153,
      "val_loss": 0.0003366221596176426,
      "has_nan": false,
      "trainable": true
    },
    {
      "symbol": "DCE.I",
      "status": "success",
      "error": null,
      "n_bars": 661764,
      "n_train_samples": 5704,
      "n_val_samples": 726,
      "train_loss_first": 0.05192389339208603,
      "train_loss_last": 0.0016603730618953705,
      "val_loss": 0.0009866361894334357,
      "has_nan": false,
      "trainable": true
    },
    {
      "symbol": "DCE.JD",
      "status": "error",
      "error": "Failed to load DCE.JD: bars.parquet not found for DCE.JD",
      "n_bars": 0,
      "n_train_samples": 0,
      "n_val_samples": 0,
      "train_loss_first": null,
      "train_loss_last": null,
      "val_loss": null,
      "has_nan": false,
      "trainable": false
    },
    {
      "symbol": "DCE.L",
      "status": "error",
      "error": "Failed to load DCE.L: bars.parquet not found for DCE.L",